beam_id,title,category_main_group,category_sub_group,category,categories,address,street,city,state,borough,neighborhood,postal_code,country,address_verified,latitude,longitude,timezone,phone,price_level,business_status,has_open_hours,has_price,census_place,verified_census_city,beam_location_name,beam_state_code,beam_country_code,website_protocol,website,website_normalized,website_domain,website_domain_tld,website_domain_age,website_domain_registered,website_domain_expires,website_domain_registrar,emails_list,emails_list_website_domain,emails_count,emails_deliverable_count,emails_risky_count,description,has_about,has_description,rating,reviews_total_count,reviews_per_rating,service_options,highlights,popular_for,accessibility,offerings,dining_options,amenities,atmosphere,crowd,planning,payments,children,has_popular_times,has_website,has_email,has_social,has_phone,socials_count,first_social_post_date,last_social_post_date,first_social_post_days,last_social_post_days,social_post_count,first_social_post_days_min,first_social_post_days_max,last_social_post_days_min,last_social_post_days_max,social_profile_instagram,social_username_instagram,social_profile_facebook,social_username_facebook,social_profile_twitter,social_username_twitter,social_profile_tiktok,social_username_tiktok,social_profile_linkedin,social_username_linkedin,social_profile_youtube,social_username_youtube,social_profile_github,social_username_github,social_profile_snapchat,social_username_snapchat,social_profile_pinterest,social_username_pinterest,instagram_followers,instagram_engagement_rate,instagram_engagement_rate_1m,instagram_engagement_rate_3m,instagram_engagement_rate_6m,instagram_engagement_rate_12m,instagram_post_count,tiktok_followers,tiktok_video_count,tiktok_heart_count,tiktok_engagement_rate,tiktok_engagement_rate_1m,tiktok_engagement_rate_3m,tiktok_engagement_rate_6m,tiktok_engagement_rate_12m,menu_link,order_links,reservation_link,last_updated_at,beam_cross_social_market_penetration,beam_cross_velocity_quality,beam_cross_social_urgency,beam_cross_per_capita_engagement,beam_cross_market_saturation_lead,beam_cross_population_adjusted_rank,beam_cross_demand_gap_index,beam_rating_score,beam_review_confidence,beam_rating_health,sentiment_avg,sentiment_avg_30d,sentiment_avg_90d,sentiment_avg_180d,sentiment_avg_360d,sentiment_percentile_1km,sentiment_percentile_5km,sentiment_percentile_10km,sentiment_score_90d,sentiment_score_360d,sentiment_positive_pct_30d,sentiment_negative_pct_30d,sentiment_neutral_pct_30d,sentiment_positive_pct_90d,sentiment_negative_pct_90d,sentiment_neutral_pct_90d,sentiment_positive_pct_180d,sentiment_negative_pct_180d,sentiment_neutral_pct_180d,sentiment_positive_pct_360d,sentiment_negative_pct_360d,sentiment_neutral_pct_360d,sentiment_trend_30vs90d,sentiment_trend_90vs360d,sentiment_diff_30vs90d,sentiment_change_360d,sentiment_diff_90vs360d,sentiment_change_pct_360d,reviews_count_30d,reviews_count_90d,reviews_count_180d,reviews_count_360d,review_growth_pct_180d,review_growth_pct_360d,review_growth_pct_90d,beam_score_overall,beam_popularity_percentile,beam_social_presence,beam_data_completeness,beam_price_value,beam_data_freshness,beam_rank_city_category,beam_rank_city_overall,beam_rank_city_reviews,beam_rank_state_category,beam_rank_state_overall,beam_rank_state_reviews,beam_rank_country_category,beam_rank_country_overall,beam_rank_country_reviews,beam_rank_place_global_category,beam_rank_category,beam_rank_competition_1km_category,beam_rank_competition_1km_total,beam_rank_competition_1km_reviews,beam_rank_competition_5km_category,beam_rank_competition_5km_total,beam_rank_competition_5km_reviews,beam_rank_competition_10km_category,beam_rank_competition_10km_total,beam_rank_competition_10km_reviews,beam_export_rank,total_city_category,total_city,total_state_category,total_state,total_country_category,total_country,total_category_global,beam_competitors_10km_competitive_strength,beam_competitors_10km_competitor_avg_sentiment_30d,beam_competitors_10km_competitor_avg_sentiment_90d,beam_competitors_10km_sentiment_diff_30d,beam_competitors_10km_sentiment_diff_90d,beam_competitors_1km_competitive_strength,beam_competitors_1km_competitor_avg_sentiment_30d,beam_competitors_1km_competitor_avg_sentiment_90d,beam_competitors_1km_sentiment_diff_30d,beam_competitors_1km_sentiment_diff_90d,beam_competitors_5km_competitive_strength,beam_competitors_5km_competitor_avg_sentiment_30d,beam_competitors_5km_competitor_avg_sentiment_90d,beam_competitors_5km_sentiment_diff_30d,beam_competitors_5km_sentiment_diff_90d,beam_competitors_10km_competitor_count,beam_competitors_1km_competitor_count,beam_competitors_5km_competitor_count,beam_competitors_1km_rank_by_score,beam_competitors_1km_rank_by_rating,beam_competitors_1km_rank_by_reviews,beam_competitors_1km_score_percentile,beam_competitors_1km_rating_percentile,beam_competitors_1km_reviews_percentile,beam_competitors_1km_health_percentile,beam_competitors_1km_sentiment_percentile,beam_competitors_1km_competitor_avg_score,beam_competitors_1km_competitor_avg_rating,beam_competitors_1km_competitor_avg_reviews,beam_competitors_1km_competitor_avg_health,beam_competitors_1km_competitor_avg_sentiment,beam_competitors_1km_score_diff,beam_competitors_1km_rating_diff,beam_competitors_1km_reviews_diff,beam_competitors_1km_health_diff,beam_competitors_1km_sentiment_diff,beam_competitors_5km_rank_by_score,beam_competitors_5km_rank_by_rating,beam_competitors_5km_rank_by_reviews,beam_competitors_5km_score_percentile,beam_competitors_5km_rating_percentile,beam_competitors_5km_reviews_percentile,beam_competitors_5km_health_percentile,beam_competitors_5km_sentiment_percentile,beam_competitors_5km_competitor_avg_score,beam_competitors_5km_competitor_avg_rating,beam_competitors_5km_competitor_avg_reviews,beam_competitors_5km_competitor_avg_health,beam_competitors_5km_competitor_avg_sentiment,beam_competitors_5km_score_diff,beam_competitors_5km_rating_diff,beam_competitors_5km_reviews_diff,beam_competitors_5km_health_diff,beam_competitors_5km_sentiment_diff,beam_competitors_10km_rank_by_score,beam_competitors_10km_rank_by_rating,beam_competitors_10km_rank_by_reviews,beam_competitors_10km_score_percentile,beam_competitors_1km_competitive_tier,beam_competitors_10km_rating_percentile,beam_competitors_10km_reviews_percentile,beam_competitors_10km_health_percentile,beam_competitors_10km_sentiment_percentile,beam_competitors_5km_competitive_tier,beam_competitors_10km_competitor_avg_score,beam_competitors_10km_competitor_avg_rating,beam_competitors_10km_competitor_avg_reviews,beam_competitors_10km_competitor_avg_health,beam_competitors_10km_competitive_tier,beam_competitors_10km_competitor_avg_sentiment,beam_competitors_10km_score_diff,beam_competitors_10km_rating_diff,beam_competitors_10km_reviews_diff,beam_competitors_10km_health_diff,beam_competitors_10km_sentiment_diff,beam_competitors_1km_total_in_radius,beam_competitors_5km_total_in_radius,beam_competitors_10km_total_in_radius,beam_competitors_1km_avg_distance_m,beam_competitors_1km_closest_competitor_m,beam_competitors_1km_market_type,beam_competitors_1km_review_share,beam_competitors_1km_density_per_sqkm,beam_competitors_1km_tier_below_40,beam_competitors_1km_tier_40_59,beam_competitors_1km_tier_60_79,beam_competitors_1km_tier_80_100,beam_competitors_5km_avg_distance_m,beam_competitors_5km_closest_competitor_m,beam_competitors_5km_market_type,beam_competitors_5km_review_share,beam_competitors_5km_density_per_sqkm,beam_competitors_5km_tier_below_40,beam_competitors_5km_tier_40_59,beam_competitors_5km_tier_60_79,beam_competitors_5km_tier_80_100,beam_competitors_10km_avg_distance_m,beam_competitors_10km_closest_competitor_m,beam_competitors_10km_market_type,beam_competitors_10km_review_share,beam_competitors_10km_density_per_sqkm,beam_competitors_10km_tier_below_40,beam_competitors_10km_tier_40_59,beam_competitors_10km_tier_60_79,beam_competitors_10km_tier_80_100,beam_competitors_city_competitor_avg_sentiment_30d,beam_competitors_city_competitor_avg_sentiment_90d,beam_competitors_city_sentiment_diff_30d,beam_competitors_city_sentiment_diff_90d,beam_competitors_city_competitor_count,beam_competitors_city_total_in_city,beam_competitors_city_rank_by_score,beam_competitors_city_rank_by_rating,beam_competitors_city_rank_by_reviews,beam_competitors_city_score_percentile,beam_competitors_city_rating_percentile,beam_competitors_city_reviews_percentile,beam_competitors_city_health_percentile,beam_competitors_city_sentiment_percentile,beam_competitors_city_competitor_avg_score,beam_competitors_city_competitor_avg_rating,beam_competitors_city_competitor_avg_reviews,beam_competitors_city_competitor_avg_health,beam_competitors_city_competitor_avg_sentiment,beam_competitors_city_score_diff,beam_competitors_city_rating_diff,beam_competitors_city_reviews_diff,beam_competitors_city_health_diff,beam_competitors_city_sentiment_diff,beam_competitors_city_market_type,beam_competitors_city_review_share,beam_competitors_city_density_per_sqkm,beam_competitors_city_tier_below_40,beam_competitors_city_tier_40_59,beam_competitors_city_tier_60_79,beam_competitors_city_tier_80_100,beam_competitors_city_competitive_strength,beam_competitors_city_underserved_score,beam_competitors_city_competition_intensity,beam_competitors_state_competitor_avg_sentiment_30d,beam_competitors_state_competitor_avg_sentiment_90d,beam_competitors_state_sentiment_diff_30d,beam_competitors_state_sentiment_diff_90d,beam_competitors_state_competitor_count,beam_competitors_state_total_in_state,beam_competitors_state_rank_by_score,beam_competitors_state_rank_by_rating,beam_competitors_state_rank_by_reviews,beam_competitors_state_score_percentile,beam_competitors_state_rating_percentile,beam_competitors_state_reviews_percentile,beam_competitors_state_health_percentile,beam_competitors_state_sentiment_percentile,beam_competitors_state_competitor_avg_score,beam_competitors_state_competitor_avg_rating,beam_competitors_state_competitor_avg_reviews,beam_competitors_state_competitor_avg_health,beam_competitors_state_competitor_avg_sentiment,beam_competitors_state_score_diff,beam_competitors_state_rating_diff,beam_competitors_state_reviews_diff,beam_competitors_state_health_diff,beam_competitors_state_sentiment_diff,beam_competitors_state_market_type,beam_competitors_state_review_share,beam_competitors_state_density_per_sqkm,beam_competitors_state_underserved_score,beam_competitors_state_competition_intensity,beam_competitors_state_competitive_strength,beam_competitors_country_competitor_avg_sentiment_30d,beam_competitors_country_competitor_avg_sentiment_90d,beam_competitors_country_sentiment_diff_30d,beam_competitors_country_sentiment_diff_90d,beam_competitors_country_competitor_count,beam_competitors_country_competitor_avg_score,beam_competitors_country_competitor_avg_rating,beam_competitors_country_competitor_avg_reviews,beam_competitors_country_competitor_avg_health,beam_competitors_country_competitor_avg_sentiment,beam_competitors_country_score_diff,beam_competitors_country_rating_diff,beam_competitors_country_reviews_diff,beam_competitors_country_sentiment_diff,beam_competitors_country_score_percentile,beam_competitors_country_rating_percentile,beam_competitors_country_reviews_percentile,beam_competitors_country_health_percentile,beam_competitors_country_sentiment_percentile,beam_competitors_country_rank_by_score,beam_competitors_country_competitive_strength,beam_competitors_country_health_diff,beam_competitors_country_rank_by_rating,beam_competitors_country_rank_by_reviews,beam_competitors_country_tier_40_59,beam_competitors_country_tier_60_79,beam_competitors_country_tier_80_100,beam_competitors_country_tier_below_40,beam_competitors_country_total_in_country,beam_competitors_city_siblings_competitor_count,beam_competitors_city_siblings_competitor_avg_score,beam_competitors_city_siblings_competitor_avg_rating,beam_competitors_city_siblings_competitor_avg_reviews,beam_competitors_city_siblings_competitor_avg_health,beam_competitors_city_siblings_competitor_avg_sentiment,beam_competitors_city_siblings_score_diff,beam_competitors_city_siblings_rating_diff,beam_competitors_city_siblings_reviews_diff,beam_competitors_city_siblings_sentiment_diff,beam_competitors_city_siblings_score_percentile,beam_competitors_city_siblings_rating_percentile,beam_competitors_city_siblings_reviews_percentile,beam_competitors_city_siblings_health_percentile,beam_competitors_city_siblings_sentiment_percentile,beam_competitors_city_siblings_rank_by_score,beam_competitors_city_siblings_competitor_avg_recommend_pct,beam_competitors_city_siblings_recommend_pct_diff,beam_competitors_city_siblings_recommend_pct_percentile,beam_competitors_city_siblings_total_siblings,beam_competitors_city_businesses_per_10k_pop,beam_competitors_city_population_per_business,beam_competitors_city_population_density,beam_competitors_city_reviews_per_capita,beam_competitors_city_reviews_per_10k_pop,beam_competitors_state_businesses_per_10k_pop,beam_competitors_state_population_per_business,beam_competitors_state_population_density,beam_competitors_state_reviews_per_capita,beam_competitors_state_reviews_per_10k_pop,beam_competitors_1km_hhi_contribution,beam_competitors_1km_hhi_minimum,beam_competitors_5km_hhi_contribution,beam_competitors_5km_hhi_minimum,beam_competitors_10km_hhi_contribution,beam_competitors_10km_hhi_minimum,beam_competitors_city_hhi_contribution,beam_competitors_city_hhi_minimum,beam_competitors_state_hhi_contribution,beam_competitors_state_hhi_minimum,beam_trends_score_30d_beam_score_overall,beam_trends_score_30d_rating,beam_trends_score_30d_review_count,beam_trends_score_30d_beam_rating_health,beam_trends_score_30d_beam_popularity_percentile,beam_trends_score_90d_beam_score_overall,beam_trends_score_90d_rating,beam_trends_score_90d_review_count,beam_trends_score_90d_beam_rating_health,beam_trends_score_90d_beam_popularity_percentile,beam_trends_competitive_1km_30d_strength_change,beam_trends_competitive_1km_30d_rank_change,beam_trends_competitive_1km_30d_percentile_change,beam_trends_competitive_1km_90d_strength_change,beam_trends_competitive_1km_90d_rank_change,beam_trends_competitive_1km_90d_percentile_change,beam_trends_competitive_5km_30d_strength_change,beam_trends_competitive_5km_30d_rank_change,beam_trends_competitive_5km_30d_percentile_change,beam_trends_competitive_5km_90d_strength_change,beam_trends_competitive_5km_90d_rank_change,beam_trends_competitive_5km_90d_percentile_change,beam_trends_competitive_10km_30d_strength_change,beam_trends_competitive_10km_30d_rank_change,beam_trends_competitive_10km_30d_percentile_change,beam_trends_competitive_10km_90d_strength_change,beam_trends_competitive_10km_90d_rank_change,beam_trends_competitive_10km_90d_percentile_change,beam_trends_competitive_city_30d_strength_change,beam_trends_competitive_city_30d_rank_change,beam_trends_competitive_city_30d_percentile_change,beam_trends_competitive_city_90d_strength_change,beam_trends_competitive_city_90d_rank_change,beam_trends_competitive_city_90d_percentile_change,beam_trends_competitive_state_30d_strength_change,beam_trends_competitive_state_30d_rank_change,beam_trends_competitive_state_30d_percentile_change,beam_trends_competitive_state_90d_strength_change,beam_trends_competitive_state_90d_rank_change,beam_trends_competitive_state_90d_percentile_change,beam_trends_sentiment_current_sentiment,beam_trends_sentiment_positive_ratio,beam_trends_sentiment_negative_ratio,beam_trends_sentiment_review_count,beam_trends_velocity_reviews_per_day,beam_trends_velocity_reviews_per_month,beam_trends_velocity_percentile_city,beam_trends_velocity_percentile_state,beam_trends_velocity_trend,beam_velocity_reviews_per_day,beam_velocity_reviews_per_week,beam_velocity_reviews_per_month,beam_velocity_reviews_last_30d,beam_velocity_reviews_last_90d,beam_velocity_reviews_last_365d,beam_velocity_percentile_1km,beam_velocity_percentile_5km,beam_velocity_percentile_10km,beam_velocity_percentile_city,beam_velocity_percentile_state,beam_velocity_rank_1km,beam_velocity_rank_5km,beam_velocity_rank_10km,beam_velocity_rank_city,beam_velocity_rank_state,beam_velocity_trend,beam_velocity_change_30d,beam_velocity_change_90d,beam_trends_sentiment_recommend_pct
B24RQ4AX,Alberto's Mexican Food - Chino Hills,Food and Drink,Restaurants,Mexican restaurant,Mexican restaurant,"3060 Chino Ave ste a, Chino Hills, CA 91709",3060 Chino Ave ste a,Chino Hills,California,,,91709,US,True,34.0122047,-117.73903519999999,America/Los_Angeles,(909) 62*-****,1,OPERATIONAL,TRUE,TRUE,,True,Chino Hills,California,US,https,https://albertosmexicanfoodhillsca.com,albertosmexicanfoodhillsca.com,albertosmexicanfoodhillsca.com,com,353,2025-04-28,2026-04-28,Hosting Concepts B.V. d/b/a Registrar.eu,,,0,0,0,"Mexican fast-food chain dishing up breakfast burritos, tacos, tortas & combination platters.",TRUE,TRUE,4,0,"{""1"": 52, ""2"": 25, ""3"": 47, ""4"": 107, ""5"": 233}","Outdoor seating, Delivery, Takeout, Dine-in","Fast service, Rooftop seating, Sports","Breakfast, Lunch, Dinner, Solo dining","Wheelchair accessible entrance, Wheelchair accessible parking lot, Wheelchair accessible restroom, Wheelchair accessible seating","Coffee, Comfort food, Late-night food, Quick bite, Small plates","Breakfast, Lunch, Dinner, Catering, Counter service, Dessert, Seating","Gender-neutral restroom, Restroom","Casual, Quiet","College students, Family-friendly, Groups, LGBTQ+ friendly, Tourists",,"Credit cards, Debit cards, NFC mobile payments","Good for kids, High chairs, Kids' menu",TRUE,TRUE,purchase_dataset@,FALSE,TRUE,0,,,,,,,,,,,,,,,,,,,,,,,,,,,,,,,,,,,,,,,,,,,https://albertosmexicanfoodhillsca.com,,,2026-04-11T12:39:19.476325+00:00,,,,,,,,0.0,0.0,50.0,0.3735,0.9842,0.3137,0.0577,0.345,,,,65.7,67.2,100.0,0.0,0.0,60.0,40.0,0.0,44.44,44.44,11.11,62.5,31.25,6.25,improving,stable,0.6705,-1.5,-0.0313,-2.2,2,5,9,16,11.1,25.0,20.0,29.3,19.5,0,67,50.0,94.0,145,217,217,83476,156748,156748,687053,1412425,1412425,741362,145,,,,,,,,,,137,149,226,89056,166785,735647,1464979,735647,,,,,,,,,,,,,,,,,,,,,,,,,,,,,,,,,,,,,,,,,,,,,,,,,,,,,,,,,,,,,,,,,,,,,,,,,,,,,,,,,,,,,,,,,,,,,,,,,,,,,,,,,,,,,,,,,,,,,,,,,,,,,,,,,,,,,,,,,,,,,,,,,,,,,,,,,,,,,,,,,,,,,,,,,,,,,,,,,,,,,,,,,,,,,,,,,,,,,,,115,62.9,4.27,320,80.3,0.5408,-33.6,,-320,-0.5408,0.0439,0.9561,0.0,0.0,0.0,110,68.37,-68.37,0.0,115,,,,,,,,,,,,,,,,,,,,,0.0,,0,0.0,0.0,,,,,,,,,,,,,,,,,,,,,,,,,,,,,,,,,,,,,,,,,,,,,,,,,,,,,,,,,,,,,,,,
CRCQNZYC,Paik's Noodle Chino hills,Food and Drink,Restaurants,Korean restaurant,Korean restaurant,"4200 Chino Hills Pkwy, Chino Hills, CA 91709",4200 Chino Hills Pkwy,Chino Hills,California,,,91709,US,True,33.9841761,-117.7145281,America/Los_Angeles,,0,CLOSED_TEMPORARILY,FALSE,FALSE,,True,Chino Hills,California,US,,,,,,,,,,,,0,0,0,,FALSE,FALSE,5,0,"{""1"": 0, ""2"": 0, ""3"": 0, ""4"": 0, ""5"": 1}",,,,,,,,,,,,,FALSE,FALSE,purchase_dataset@,FALSE,FALSE,0,,,,,,,,,,,,,,,,,,,,,,,,,,,,,,,,,,,,,,,,,,,,,,2026-04-10T22:15:22.861679+00:00,,,,,,,,0.0,0.0,50.0,,,,,,,,,,,,,,,,,,,,,,,,,,,,,,,,,,,,22.5,19.5,0,17,50.0,58.0,146,219,219,83884,157854,157854,690964,1424154,1424154,745591,146,,,,,,,,,,137,149,226,89056,166785,735647,1464979,735647,,,,,,,,,,,,,,,,,,,,,,,,,,,,,,,,,,,,,,,,,,,,,,,,,,,,,,,,,,,,,,,,,,,,,,,,,,,,,,,,,,,,,,,,,,,,,,,,,,,,,,,,,,,,,,,,,,,,,,,,,,,,,,,,,,,,,,,,,,,,,,,,,,,,,,,,,,,,,,,,,,,,,,,,,,,,,,,,,,,,,,,,,,,,,,,,,,,,,,,115,62.9,4.27,320,80.3,0.5408,-40.4,,-320,-0.5408,0.0,0.9561,0.0,0.0,0.0,115,68.37,-68.37,0.0,115,,,,,,,,,,,,,,,,,,,,,0.0,,0,0.0,0.0,,,,,,,,,,,,,,,,,,,,,,,,,,,,,,,,,,,,,,,,,,,,,,,,,,,,,,,,,,,,,,,,
LTRDWUAR,Tasty Spot Cafe,Food and Drink,Restaurants,Restaurant,"Restaurant, Chinese restaurant","13161 Peyton Dr # B, Chino Hills, CA 91709",13161 Peyton Dr # B,Chino Hills,California,,,91709,US,True,34.0131734,-117.7432644,America/Los_Angeles,(909) 81*-****,1,OPERATIONAL,TRUE,TRUE,,True,Chino Hills,California,US,https,https://tastyspotcafeca.com,tastyspotcafeca.com,tastyspotcafeca.com,com,317,2025-06-03,2026-06-03,Wix.com Ltd.,,,0,0,0,,TRUE,FALSE,3.7,0,"{""1"": 22, ""2"": 5, ""3"": 9, ""4"": 21, ""5"": 50}","Takeout, Dine-in",,"Breakfast, Lunch, Dinner, Solo dining","Wheelchair accessible entrance, Wheelchair accessible parking lot, Wheelchair accessible restroom, Wheelchair accessible seating","Coffee, Comfort food, Quick bite, Small plates","Breakfast, Brunch, Lunch, Dinner, Dessert",Restroom,Casual,Groups,,"Credit cards, Debit cards, NFC mobile payments",Good for kids,TRUE,TRUE,purchase_dataset@,FALSE,TRUE,0,,,,,,,,,,,,,,,,,,,,,,,,,,,,,,,,,,,,,,,,,,,,,,2026-04-10T22:14:52.766389+00:00,,,,,,,,0.0,0.0,50.0,0.1966,0.0,-0.1455,-0.2315,0.0751,,,,42.7,53.8,50.0,50.0,0.0,45.45,54.55,0.0,37.5,56.25,6.25,53.13,40.63,6.25,improving,declining,0.1455,-11.1,-0.2206,-20.6,4,11,16,32,37.5,37.5,9.1,25.8,19.5,0,50,50.0,58.0,148,223,223,85960,163260,163260,709095,1478734,1478734,765101,148,,,,,,,,,,137,149,226,89056,166785,735647,1464979,735647,,,,,,,,,,,,,,,,,,,,,,,,,,,,,,,,,,,,,,,,,,,,,,,,,,,,,,,,,,,,,,,,,,,,,,,,,,,,,,,,,,,,,,,,,,,,,,,,,,,,,,,,,,,,,,,,,,,,,,,,,,,,,,,,,,,,,,,,,,,,,,,,,,,,,,,,,,,,,,,,,,,,,,,,,,,,,,,,,,,,,,,,,,,,,,,,,,,,,,,115,62.9,4.27,320,80.3,0.5408,-37.1,,-320,-0.5408,0.0088,0.9561,0.0,0.0,0.0,114,68.37,-68.37,0.0,115,,,,,,,,,,,,,,,,,,,,,0.0,,0,0.0,0.0,,,,,,,,,,,,,,,,,,,,,,,,,,,,,,,,,,,,,,,,,,,,,,,,,,,,,,,,,,,,,,,,
RYJKZY69,Casa Juanchos,Food and Drink,Restaurants,Mexican restaurant,Mexican restaurant,"3277 Grand Ave Unit M, Chino Hills, CA 91709",3277 Grand Ave Unit M,Chino Hills,California,,,91709,US,True,34.0007191,-117.7336904,America/Los_Angeles,(909) 32*-****,1,,TRUE,TRUE,,True,Chino Hills,California,US,http,http://casajuanchos.com,casajuanchos.com,casajuanchos.com,com,1188,2023-01-14,2027-01-14,"GoDaddy.com, LLC",,,0,0,0,,TRUE,FALSE,4.2,0,"{""1"": 25, ""2"": 16, ""3"": 23, ""4"": 57, ""5"": 186}","Outdoor seating, Delivery, Onsite services, Takeout, Dine-in","Fast service, Serves local specialty","Breakfast, Lunch, Dinner, Solo dining","Wheelchair accessible entrance, Wheelchair accessible parking lot, Wheelchair accessible restroom, Wheelchair accessible seating","Coffee, Comfort food, Quick bite, Small plates","Breakfast, Brunch, Lunch, Dinner, Catering, Counter service, Dessert, Seating","Restroom, Wi-Fi","Casual, Cozy","Family-friendly, Groups, LGBTQ+ friendly, Transgender safespace",,"Credit cards, Debit cards, NFC mobile payments","Good for kids, High chairs, Kids' menu",TRUE,TRUE,purchase_dataset@,FALSE,TRUE,0,,,,,,,,,,,,,,,,,,,,,,,,,,,,,,,,,,,,,,,,,,,,,,2026-04-10T21:05:59.132125+00:00,,,,,,,,0.0,0.0,50.0,,,,,,,,,,,,,,,,,,,,,,,,,,,,,,,,,,,,27.9,19.5,0,50,50.0,100.0,149,226,226,87211,166612,166612,719914,1513282,1513282,776798,149,,,,,,,,,,137,149,226,89056,166785,735647,1464979,735647,,,,,,,,,,,,,,,,,,,,,,,,,,,,,,,,,,,,,,,,,,,,,,,,,,,,,,,,,,,,,,,,,,,,,,,,,,,,,,,,,,,,,,,,,,,,,,,,,,,,,,,,,,,,,,,,,,,,,,,,,,,,,,,,,,,,,,,,,,,,,,,,,,,,,,,,,,,,,,,,,,,,,,,,,,,,,,,,,,,,,,,,,,,,,,,,,,,,,,,115,62.9,4.27,320,80.3,0.5408,-35.0,,-320,-0.5408,0.0263,0.9561,0.0,0.0,0.0,112,68.37,-68.37,0.0,115,,,,,,,,,,,,,,,,,,,,,0.0,,0,0.0,0.0,,,,,,,,,,,,,,,,,,,,,,,,,,,,,,,,,,,,,,,,,,,,,,,,,,,,,,,,,,,,,,,,
7JAGAJ67,Eggbred,Food and Drink,Restaurants,Breakfast restaurant,Breakfast restaurant,"4200 Chino Hills Pkwy #900, Chino Hills, CA 91709",4200 Chino Hills Pkwy #900,Chino Hills,California,,,91709,US,True,33.984243899999996,-117.7144711,America/Los_Angeles,(909) 28*-****,1,OPERATIONAL,TRUE,TRUE,,True,Chino Hills,California,US,,,,,,,,,,,,0,0,0,,TRUE,FALSE,4.6,0,"{""1"": 0, ""2"": 2, ""3"": 0, ""4"": 3, ""5"": 15}","Curbside pickup, No-contact delivery, Delivery, Takeout, Dine-in",Great coffee,"Breakfast, Solo dining","Wheelchair accessible entrance, Wheelchair accessible parking lot, Wheelchair accessible restroom, Wheelchair accessible seating","Coffee, Comfort food, Quick bite","Breakfast, Brunch, Lunch, Catering, Counter service, Dessert, Seating","Gender-neutral restroom, Restroom, Wi-Fi",Casual,"Family-friendly, LGBTQ+ friendly, Transgender safespace",,"Credit cards, Debit cards, NFC mobile payments","Good for kids, Has changing table(s), High chairs, Kids' menu",FALSE,FALSE,purchase_dataset@,FALSE,TRUE,0,,,,,,,,,,,,,,,,,,,,,,,,,,,,,,,,,,,,,,,,,,,https://eggbred.com/menu,,,2026-04-10T19:44:19.851403+00:00,,,,,,,,0.0,0.0,50.0,,,,,,,,,,,,,,,,,,,,,,,,,,,,,,,,,,,,26.2,19.5,0,33,50.0,100.0,144,216,216,82621,154479,154479,679187,1388993,1388993,732903,144,,,,,,,,,,137,149,226,89056,166785,735647,1464979,735647,,,,,,,,,,,,,,,,,,,,,,,,,,,,,,,,,,,,,,,,,,,,,,,,,,,,,,,,,,,,,,,,,,,,,,,,,,,,,,,,,,,,,,,,,,,,,,,,,,,,,,,,,,,,,,,,,,,,,,,,,,,,,,,,,,,,,,,,,,,,,,,,,,,,,,,,,,,,,,,,,,,,,,,,,,,,,,,,,,,,,,,,,,,,,,,,,,,,,,,115,62.9,4.27,320,80.3,0.5408,-36.7,,-320,-0.5408,0.0175,0.9561,0.0,0.0,0.0,113,68.37,-68.37,0.0,115,,,,,,,,,,,,,,,,,,,,,1.8,,0,0.0,0.0,,,,,,,,,,,,,,,,,,,,,,,,,,,,,,,,,,,,,,,,,,,,,,,,,,,,,,,,,,,,,,,,
